#postgres commands...........


1. \l 
        list all the databases which are awailable in postgres

2. \c 
        connect to other databases

3. \d   
        display or describe the table

4. \q 
        to quit

5. create database mydb;

        for creating the database

6. drop database mydb;

        for deleting the database

7. how to create table in database


    create table info(id integer not null primary key,fname text not null,lname text not null, age integer not null);

8. create schema mysch;

        for creating schema in database.   here mysch- schema name

9. drop schema mysch
        delete schema

10 . for entering values in table..


    insert into info(id,fname,lname,age)
    values(1,'AB','Bhoi',22);

            or
    insert into info values(1,'AB','Bhoi',22);

        # we can add multiple values like this ,,,

    insert into info values(1,'AB','Bhoi',22),(2,'Gandhi','Lakh',88);


11. update table values (Table Name : emp)

suppose........................

id     fname    lname     age

1.     Arpan     Bhoi     22
2.     Hello      ji      70

...............................


CODE :

update emp
set fname="Priya"
where id=2;


12. update multiple records :

mydb=# select * from info;

 id |  fname  | lname  | age |    dept
----+---------+--------+-----+------------
 10 | Rahul   | Gandhi |  22 |
 11 | Ronak   | Parmar |  25 |
 12 | Minku   | Mili   |  21 |
 13 | Bhagya  | Megha  |  22 |
 14 | Pragna  | Bhoi   |  46 |
 15 | Appu    | Bhoi   |  50 |
  1 | Arpan   | Bhoi   |  22 | CSE
  2 | Bhavin  | Sakh   |  22 | CSE
  3 | Vaibhav | Patel  |  22 | Civil
  4 | Ashu    | Bhoi   |  56 | Electrical
  5 | Tirth   | Patel  |  22 | mech
  6 | Rakesh  | Patel  |  66 | Electrical
  7 | Rahul   | Singh  |  45 | IT
  8 | Siddhi  | Patel  |  21 | mech




mydb=# update info
mydb-# set id=8,
mydb-# dept='mech'
mydb-# where fname='Siddhi';



13 . add column in table 

mydb=# alter table info
mydb-# add column dept varchar;
ALTER TABLE
mydb=# select * from info;
 id |  fname  | lname  | age | dept
----+---------+--------+-----+------
  1 | Arpan   | Bhoi   |  22 |
  2 | Bhavin  | Sakh   |  22 |
  3 | Vaibhav | Patel  |  22 |
  4 | Ashu    | Bhoi   |  56 |
  5 | Tirth   | Patel  |  22 |
  6 | Rakesh  | Patel  |  66 |
  7 | Rahul   | Singh  |  45 |
  9 | Siddhi  | Patel  |  21 |
 10 | Rahul   | Gandhi |  22 |
 11 | Ronak   | Parmar |  25 |
 12 | Minku   | Mili   |  21 |
 13 | Bhagya  | Megha  |  22 |
 14 | Pragna  | Bhoi   |  46 |
 15 | Appu    | Bhoi   |  50 |
(14 rows)





14 . SELECT statements.(Queries)

mydb=# select * from info;
 id |  fname  | lname  | age |    dept
----+---------+--------+-----+------------
  1 | Arpan   | Bhoi   |  22 | CSE
  2 | Bhavin  | Sakh   |  22 | CSE
  3 | Vaibhav | Patel  |  22 | Civil
  4 | Ashu    | Bhoi   |  56 | Electrical
  5 | Tirth   | Patel  |  22 | mech
  6 | Rakesh  | Patel  |  66 | Electrical
  8 | Siddhi  | Patel  |  21 | mech
  7 | Rahul   | Singh  |  45 | IT
  9 | Rahi    | Patel  |  32 | bsc
 10 | INDRA   | Patel  |  22 | mech
 11 | manish  | Patel  |  67 | ele
 12 | tuger   | Patel  |  22 | ele
 13 | dhvani  | Patel  |  23 | mech
 14 | carry   | Patel  |  22 | IT
 15 | Ashu    | Patel  |  22 | chem
 16 | Krunal  | Bhoi   |  25 | IT
 17 | darsh   | parmar |  26 | IT
(17 rows)




Q1 ..........................................

mydb=# select fname,dept,age
mydb-# from info
mydb-# where age>=60;
 fname  |    dept    | age
--------+------------+-----
 Rakesh | Electrical |  66
 manish | ele        |  67
(2 rows)




Q2............................................

mydb=# select fname
mydb-# from info
mydb-# where lname='Patel';
  fname
---------
 Vaibhav
 Tirth
 Rakesh
 Siddhi
 Rahi
 INDRA
 manish
 tuger
 dhvani
 carry
 Ashu
(11 rows)



Q3............................................

mydb=# select fname,dept,age
mydb-# from info
mydb-# where age>=20 AND age<=50;
  fname  | dept  | age
---------+-------+-----
 Arpan   | CSE   |  22
 Bhavin  | CSE   |  22
 Vaibhav | Civil |  22
 Tirth   | mech  |  22
 Siddhi  | mech  |  21
 Rahul   | IT    |  45
 Rahi    | bsc   |  32
 INDRA   | mech  |  22
 tuger   | ele   |  22
 dhvani  | mech  |  23
 carry   | IT    |  22
 Ashu    | chem  |  22
 Krunal  | IT    |  25
 darsh   | IT    |  26
(14 rows)



15. Delete 

mydb=# delete from info
mydb-# where id=17;
DELETE 1
mydb=# select * from info;
 id |  fname  | lname | age |    dept
----+---------+-------+-----+------------
  1 | Arpan   | Bhoi  |  22 | CSE
  2 | Bhavin  | Sakh  |  22 | CSE
  3 | Vaibhav | Patel |  22 | Civil
  4 | Ashu    | Bhoi  |  56 | Electrical
  5 | Tirth   | Patel |  22 | mech
  6 | Rakesh  | Patel |  66 | Electrical
  8 | Siddhi  | Patel |  21 | mech
  7 | Rahul   | Singh |  45 | IT
  9 | Rahi    | Patel |  32 | bsc
 10 | INDRA   | Patel |  22 | mech
 11 | manish  | Patel |  67 | ele
 12 | tuger   | Patel |  22 | ele
 13 | dhvani  | Patel |  23 | mech
 14 | carry   | Patel |  22 | IT
 15 | Ashu    | Patel |  22 | chem
 16 | Krunal  | Bhoi  |  25 | IT
(16 rows)





15A.... delete all the data

info=# select * from accounts;
 name  |         email
-------+------------------------
 Arpan | bhoiarpan123@gmail.com
 DOLLY | krp@gmail.com
(2 rows)




info=# delete from accounts;
DELETE 2
info=# select * from accounts;
 name | email
------+-------
(0 rows)
